url,change,changeDescription,multipleCompulsory,department,id,grade,class,name,credit,yearSemester,compulsory,restrict,select,selected,remaining,teacher,room,classTime,description,tags,english
https://selcrs.nsysu.edu.tw/menu5/showoutline.asp?SYEAR=113&SEM=2&CrsDat=CHEM524&Crsname=計算化學專題研究（二）,,,True,化學碩,CHEM524,1,不分班,"計算化學專題研究（二）
INDEPENDENT STUDIES IN COMPUTATIONAL CHEMISTRY(II)",3,期,True,50,0,2,48,邱政超,"六2,3,4()","['', '', '', '', '', '234', '']",《獨立研究》,[],True
https://selcrs.nsysu.edu.tw/menu5/showoutline.asp?SYEAR=113&SEM=2&CrsDat=CHEM526&Crsname=氣固交互作用專題研究（二）,,,True,化學碩,CHEM526,1,不分班,"氣固交互作用專題研究（二）
INDEPENDENT STUDIES IN GAS/SOLID INTERACTIONS(II)",3,期,True,50,0,1,49,蔣昭明,"六2,3,4()","['', '', '', '', '', '234', '']",《獨立研究》,[],True
https://selcrs.nsysu.edu.tw/menu5/showoutline.asp?SYEAR=113&SEM=2&CrsDat=CHEM528&Crsname=生物系統固態核磁共振專題研究（二）,,,True,化學碩,CHEM528,1,不分班,"生物系統固態核磁共振專題研究（二）
INDEPENDENT STUDIES IN SOLID STATE NMR OF BIOLOGICAL SYSTEM(II)",3,期,True,50,0,4,46,丁尚武,"六2,3,4()","['', '', '', '', '', '234', '']",《獨立研究》,[],True
https://selcrs.nsysu.edu.tw/menu5/showoutline.asp?SYEAR=113&SEM=2&CrsDat=CHEM530&Crsname=奈米力學專題研究（二）,,,True,化學碩,CHEM530,1,不分班,"奈米力學專題研究（二）
INDEPENDENT STUDIES IN NANOSCALE FORCE MEASUREMENT(II)",3,期,True,50,1,2,48,謝淑貞,"六2,3,4()","['', '', '', '', '', '234', '']",《獨立研究》,[],True
https://selcrs.nsysu.edu.tw/menu5/showoutline.asp?SYEAR=113&SEM=2&CrsDat=CHEM532&Crsname=原子光譜分析專題研究（二）,,,True,化學碩,CHEM532,1,不分班,"原子光譜分析專題研究（二）
INDEPENDENT STUDIES IN ATOMIC SPECTROMETRY(II)",3,期,True,50,0,1,49,克里斯那,"六2,3,4()","['', '', '', '', '', '234', '']",《獨立研究》,[],True
https://selcrs.nsysu.edu.tw/menu5/showoutline.asp?SYEAR=113&SEM=2&CrsDat=CHEM534&Crsname=有機質譜專題研究（二）,,,True,化學碩,CHEM534,1,不分班,"有機質譜專題研究（二）
INDEPENDENT STUDIES IN ORGANIC MASS SPECTROMETRY(II)",3,期,True,50,0,5,45,謝建台,"六2,3,4()","['', '', '', '', '', '234', '']",《獨立研究》,[],True
https://selcrs.nsysu.edu.tw/menu5/showoutline.asp?SYEAR=113&SEM=2&CrsDat=CHEM536&Crsname=微量生物分析專題研究（二）,,,True,化學碩,CHEM536,1,不分班,"微量生物分析專題研究（二）
TRACE BIOANALYSIS FOR RESEARCH TRAINING(II)",3,期,True,50,1,5,45,曾韋龍,"六2,3,4()","['', '', '', '', '', '234', '']",《獨立研究》,[],True
https://selcrs.nsysu.edu.tw/menu5/showoutline.asp?SYEAR=113&SEM=2&CrsDat=CHEM538&Crsname=超微奈米藥物生化環境分析專題研究（二）,,,True,化學碩,CHEM538,1,不分班,"超微奈米藥物生化環境分析專題研究（二）
INDEPENDENT STUDIES IN ULTRA-MICRO RESEARCH FOR NANO-PARTICLE, DRUG, BIOCHEMISTRY AND ENVIRONMENT(II)",3,期,True,50,0,2,48,吳慧芬,"六2,3,4()","['', '', '', '', '', '234', '']",《獨立研究》,[],True
https://selcrs.nsysu.edu.tw/menu5/showoutline.asp?SYEAR=113&SEM=2&CrsDat=CHEM540&Crsname=材料化學專題研究（二）,,,True,化學碩,CHEM540,1,不分班,"材料化學專題研究（二）
INDEPENDENT STUDIES IN MATERIALS CHEMISTRY(II)",3,期,True,50,0,2,48,李志聰,"六2,3,4()","['', '', '', '', '', '234', '']",《獨立研究》,[],True
https://selcrs.nsysu.edu.tw/menu5/showoutline.asp?SYEAR=113&SEM=2&CrsDat=CHEM542&Crsname=顯微影像分析專題研究（二）,,,True,化學碩,CHEM542,1,不分班,"顯微影像分析專題研究（二）
INDEPENDENT STUDIES IN MICROSCOPIC IMAGE ANALYSIS(II)",3,期,True,50,0,1,49,張柏齡,"六2,3,4()","['', '', '', '', '', '234', '']",《獨立研究》,[],True
https://selcrs.nsysu.edu.tw/menu5/showoutline.asp?SYEAR=113&SEM=2&CrsDat=CHEM544&Crsname=無機反應專題研究（二）,,,True,化學碩,CHEM544,1,不分班,"無機反應專題研究（二）
INDEPENDENT STUDIES IN INORGANIC REACTIONS(II)",3,期,True,50,0,2,48,王琢堅,"六2,3,4()","['', '', '', '', '', '234', '']",《獨立研究》,[],True
https://selcrs.nsysu.edu.tw/menu5/showoutline.asp?SYEAR=113&SEM=2&CrsDat=CHEM549&Crsname=有機化學書報討論（二）,,,True,化學碩,CHEM549,1,不分班,"有機化學書報討論（二）
SEMINAR IN ORGANIC CHEMISTRY (II)",1,期,True,50,0,18,32,廖軒宏,二3(理SC 3003-2),"['', '3', '', '', '', '', '']",《演講/參訪》,[],False
https://selcrs.nsysu.edu.tw/menu5/showoutline.asp?SYEAR=113&SEM=2&CrsDat=CHEM550&Crsname=無機化學書報討論（二）,,,True,化學碩,CHEM550,1,不分班,"無機化學書報討論（二）
SEMINAR IN INORGANIC CHEMISTRY (II)",1,期,True,50,5,16,34,蔡明利,二3(理SC 1005),"['', '3', '', '', '', '', '']",《演講/參訪》,[],False
https://selcrs.nsysu.edu.tw/menu5/showoutline.asp?SYEAR=113&SEM=2&CrsDat=CHEM551&Crsname=物理化學書報討論（二）,,,True,化學碩,CHEM551,1,不分班,"物理化學書報討論（二）
SEMINAR IN PHYSICAL CHEMISTRY (II)",1,期,True,50,0,14,36,丁尚武,二3(理CH 3002),"['', '3', '', '', '', '', '']",《演講/參訪》,[],False
https://selcrs.nsysu.edu.tw/menu5/showoutline.asp?SYEAR=113&SEM=2&CrsDat=CHEM552&Crsname=分析化學書報討論（二）,,,True,化學碩,CHEM552,1,不分班,"分析化學書報討論（二）
SEMINAR IN ANALYTICAL CHEMISTRY (II)",1,期,True,50,1,16,34,張柏齡,二3(理CH 2002),"['', '3', '', '', '', '', '']",《演講/參訪》,[],False
https://selcrs.nsysu.edu.tw/menu5/showoutline.asp?SYEAR=113&SEM=2&CrsDat=CHEM556&Crsname=有機光譜學,,,False,化學碩,CHEM556,1,不分班,"有機光譜學
SPECTROMETRIC IDENTIFICATION OF ORGANIC COMPOUNDS",3,期,False,50,7,15,35,廖志中,"四5,6,7(理SC 1003)","['', '', '', '567', '', '', '']",《講授類》,[],False
https://selcrs.nsysu.edu.tw/menu5/showoutline.asp?SYEAR=113&SEM=2&CrsDat=CHEM558&Crsname=高分子材料化學,,,False,化學碩,CHEM558,1,不分班,"高分子材料化學
POLYMERIC MATERIALS CHEMISTRY",3,期,False,50,2,4,46,李志聰,"二6,7,8(理CH 3002)","['', '678', '', '', '', '', '']",《講授類》,"['半導體化學學程', '有機和材料合成學程']",False
https://selcrs.nsysu.edu.tw/menu5/showoutline.asp?SYEAR=113&SEM=2&CrsDat=CHEM560&Crsname=高等有機金屬化學,,,False,化學碩,CHEM560,1,不分班,"高等有機金屬化學
ADVANCED ORGANOMETALLIC CHEMISTRY",3,期,False,50,2,11,39,梁蘭昌,"一6,7,8(理CH 3002)","['678', '', '', '', '', '', '']",《講授類》,[],True
https://selcrs.nsysu.edu.tw/menu5/showoutline.asp?SYEAR=113&SEM=2&CrsDat=CHEM574&Crsname=核磁共振光譜簡介,,,False,化學碩,CHEM574,1,不分班,"核磁共振光譜簡介
INTRODUCTION TO NUCLEAR MAGNETIC RESONANCE SPECTROSCOPY",3,期,False,50,0,7,43,丁尚武,"二6,7,8(理SC 0008)","['', '678', '', '', '', '', '']",《講授類》,[],False
https://selcrs.nsysu.edu.tw/menu5/showoutline.asp?SYEAR=113&SEM=2&CrsDat=CHEM578&Crsname=化學分離技術與應用,,,False,化學碩,CHEM578,1,不分班,"化學分離技術與應用
TECHNIQUES OF CHEMICAL SEPARATION AND APPLICATIONS",3,期,False,50,0,21,29,謝建台,"一2,3,4(理SC 1003)","['234', '', '', '', '', '', '']",《講授類》,[],False
