url,change,changeDescription,multipleCompulsory,department,id,grade,class,name,credit,yearSemester,compulsory,restrict,select,selected,remaining,teacher,room,classTime,description,tags,english
https://selcrs.nsysu.edu.tw/menu5/showoutline.asp?SYEAR=113&SEM=1&CrsDat=GEPE215I&Crsname=運動與健康：初級帆船,,,False,運動健康(必),GEPE215I,2,不分班,"運動與健康：初級帆船
SPORT & HEALTH: BASIC YACHTING",1,期,True,25,1,26,-1,楊智翔,"五3,4(海域中心/Marine sports center)","['', '', '', '', '34', '', '']","《體育類》
限大二以上選修。",['永續海洋休閒運動產業學程'],False
https://selcrs.nsysu.edu.tw/menu5/showoutline.asp?SYEAR=113&SEM=1&CrsDat=GEPE215J&Crsname=運動與健康：初級帆船,,,False,運動健康(必),GEPE215J,2,不分班,"運動與健康：初級帆船
SPORT & HEALTH: BASIC YACHTING",1,期,True,25,8,25,0,蔡睿洋,"五3,4(海域中心/Marine sports center)","['', '', '', '', '34', '', '']","《體育類》
限大二以上選修。
※英語授課",['永續海洋休閒運動產業學程'],False
https://selcrs.nsysu.edu.tw/menu5/showoutline.asp?SYEAR=113&SEM=1&CrsDat=GEPE216&Crsname=運動與健康：初級排球,,,False,運動健康(必),GEPE216,2,不分班,"運動與健康：初級排球
SPORT & HEALTH: BASIC VOLLEY BALL",1,期,True,50,1,51,-1,蔡宗晏,"四3,4(體育館3樓/3rd floors of Gym)","['', '', '', '34', '', '', '']","《體育類》
限大二以上選修。",[],False
https://selcrs.nsysu.edu.tw/menu5/showoutline.asp?SYEAR=113&SEM=1&CrsDat=GEPE217&Crsname=運動與健康：初級水域休閒活動,,,False,運動健康(必),GEPE217,2,不分班,"運動與健康：初級水域休閒活動
SPORT & HEALTH：BASIC AQUATIC RECREATION ACTIVITIES",1,期,True,25,0,28,-3,楊智翔,"四1,2(海域中心/Marine sports center)","['', '', '', '12', '', '', '']","《體育類》
限大二以上選修。",['永續海洋休閒運動產業學程'],False
https://selcrs.nsysu.edu.tw/menu5/showoutline.asp?SYEAR=113&SEM=1&CrsDat=GEPE217A&Crsname=運動與健康：初級水域休閒活動,,,False,運動健康(必),GEPE217A,2,不分班,"運動與健康：初級水域休閒活動
SPORT & HEALTH：BASIC AQUATIC RECREATION ACTIVITIES",1,期,True,25,1,27,-2,楊智翔,"四3,4(海域中心/Marine sports center)","['', '', '', '34', '', '', '']","《體育類》
限大二以上選修。
※英語授課",['永續海洋休閒運動產業學程'],False
https://selcrs.nsysu.edu.tw/menu5/showoutline.asp?SYEAR=113&SEM=1&CrsDat=GEPE221&Crsname=運動與健康：初級肌肉適能,,,False,運動健康(必),GEPE221,2,不分班,"運動與健康：初級肌肉適能
SPORT & HEALTH: BASIC MUSCULAR FITNESS",1,期,True,35,3,35,0,蔡宗晏,"五3,4(體適能中心/Fitness Center)","['', '', '', '', '34', '', '']","《體育類》
限大二以上選修。第一堂課請至體育館3樓體適能中心。",[],False
https://selcrs.nsysu.edu.tw/menu5/showoutline.asp?SYEAR=113&SEM=1&CrsDat=GEPE223&Crsname=運動與健康：初級競技桌球,,,False,運動健康(必),GEPE223,2,不分班,"運動與健康：初級競技桌球
SPORT & HEALTH: BASIC SPORT TABLE TENNIS",1,期,True,50,0,44,6,羅凱暘,"一8,9(桌球室/Table tennis room)","['89', '', '', '', '', '', '']","《體育類》
限大二以上選修。",[],False
https://selcrs.nsysu.edu.tw/menu5/showoutline.asp?SYEAR=113&SEM=1&CrsDat=GEPE227&Crsname=運動與健康：初級複合弓,,,False,運動健康(必),GEPE227,2,不分班,"運動與健康：初級複合弓
SPORT & HEALTH: BASIC COMPOUND BOW",1,期,True,20,14,21,-1,黃義博,"五6,7(射箭場/Archery field)","['', '', '', '', '67', '', '']","《體育類》
限大二以上選修。",[],False
https://selcrs.nsysu.edu.tw/menu5/showoutline.asp?SYEAR=113&SEM=1&CrsDat=GEPE228&Crsname=運動與健康：初級競技羽球,,,False,運動健康(必),GEPE228,2,不分班,"運動與健康：初級競技羽球
SPORT & HEALTH：BASIC ATHLETIC BADMINTON",1,期,True,50,0,49,1,林國欽,"二3,4(體育館3樓/3rd floors of Gym)","['', '34', '', '', '', '', '']","《體育類》
限大二以上選修。請有修習過初級羽球或具基本能力者再進行選修。",[],False
https://selcrs.nsysu.edu.tw/menu5/showoutline.asp?SYEAR=113&SEM=1&CrsDat=GEPE229&Crsname=運動與健康：初級水中救生,新增,8/6,False,運動健康(必),GEPE229,2,不分班,"運動與健康：初級水中救生
SPORT & HEALTH: BASIC LIFE SAVING",2,期,True,20,0,20,0,羅凱暘,,"['CD', 'CD', 'CD', 'CD', 'CD', '1234B5678', '']","《體育類》
限大二以上選修。200公尺(自由式、蛙式各100公尺)游泳6分鐘完成，方得修習本課程。",[],False
https://selcrs.nsysu.edu.tw/menu5/showoutline.asp?SYEAR=113&SEM=1&CrsDat=GEPE230&Crsname=運動與健康：初級衝浪,,,False,運動健康(必),GEPE230,2,不分班,"運動與健康：初級衝浪
SPORT & HEALTH：BASIC SURF",1,期,True,25,8,25,0,蔡睿洋,"四3,4(海域中心/Marine sports center)","['', '', '', '34', '', '', '']","《體育類》
限大二以上選修，且游泳200公尺不落地完成 (自由式或蛙式)，方得修習本課程。",['永續海洋休閒運動產業學程'],False
https://selcrs.nsysu.edu.tw/menu5/showoutline.asp?SYEAR=113&SEM=1&CrsDat=GEPE303&Crsname=運動與健康：進階集訓班,,,False,運動進階(選),GEPE303,3,不分班,"運動與健康：進階集訓班
SPORT & HEALTH:  ADVANCED ASSEMBLED TRAINING CLASS",2,期,False,100,1,40,60,"蔡宗晏,林國欽,林宗正,羅凱暘,蔡鋒樺,黃義博",二A() 四A(),"['', 'A', '', 'A', '', '', '']","《體育類》
限大三以上選修。本校校隊學生需自行加選，非校隊加選以零分計算 。",[],False
https://selcrs.nsysu.edu.tw/menu5/showoutline.asp?SYEAR=113&SEM=1&CrsDat=GEAE2105&Crsname=莎劇與文化詮釋,,,False,博雅向度一,GEAE2105,0,不分班,"莎劇與文化詮釋
APPROACHING SHAKESPEARE：FROM PAGE TO PERFORMANCE",3,期,True,50,11,50,0,林季怡,"四5,6,7(通GE 2006)","['', '', '', '567', '', '', '']",《講授類》,['國際素養微學程'],False
https://selcrs.nsysu.edu.tw/menu5/showoutline.asp?SYEAR=113&SEM=1&CrsDat=GEAE2107&Crsname=運動之美,,,False,博雅向度一,GEAE2107,0,不分班,"運動之美
THE AESTHETICS OF SPORT",2,期,True,50,2,53,-3,羅凱暘,"二8,9(體GM 1004)","['', '89', '', '', '', '', '']",《講授類》,[],False
https://selcrs.nsysu.edu.tw/menu5/showoutline.asp?SYEAR=113&SEM=1&CrsDat=GEAE2108&Crsname=台灣社會與文化,,,False,博雅向度一,GEAE2108,0,不分班,"台灣社會與文化
SOCIETY AND CULTURE IN TAIWAN",3,期,True,60,13,60,0,江政寬,"一5,6,7(通GE 1008)","['567', '', '', '', '', '', '']",《講授類》,"['日本研究學程', '環境教育學程', '地方創生與區域治理微學程', '地方敘事與創生學程', '社區文創微學程', '台日跨文化微學程', '地方敘事與文化設計微學程', '地方創生與永續發展整合學程', '臺灣研究學程']",False
https://selcrs.nsysu.edu.tw/menu5/showoutline.asp?SYEAR=113&SEM=1&CrsDat=GEAE2109&Crsname=生命禮儀與文化詮釋,,,False,博雅向度一,GEAE2109,0,不分班,"生命禮儀與文化詮釋
ANALYSIS OF CULTURE PERSPECTIVE ABOUT LIFE CEREMONY",3,期,True,90,13,90,0,楊濟襄,"一2,3,4(文LA 2004)","['234', '', '', '', '', '', '']","《講授類》
限非中文系學生修習",[],False
https://selcrs.nsysu.edu.tw/menu5/showoutline.asp?SYEAR=113&SEM=1&CrsDat=GEAE2117&Crsname=當代劇場藝術的價值與思維,,,False,博雅向度一,GEAE2117,0,不分班,"當代劇場藝術的價值與思維
MODERNISM IN THEATRE",2,期,True,50,10,50,0,林宜誠,"二8,9(文FA 3007)","['', '89', '', '', '', '', '']","《講授類》
限非劇藝系學生修習","['音樂劇學程', '法國語言、文化與社會學程']",False
https://selcrs.nsysu.edu.tw/menu5/showoutline.asp?SYEAR=113&SEM=1&CrsDat=GEAE2119&Crsname=西洋文化典故,,,False,博雅向度一,GEAE2119,0,不分班,"西洋文化典故
THE ALLUSIONS IN WESTERN CULTURE",3,期,True,50,2,50,0,盧莉茹,"二5,6,7(文LA 2003)","['', '567', '', '', '', '', '']","《講授類》
本課程為優先選修課程，依選課須知規定，優先條件為第一篩選順序，志願序或點數加選為次要篩選順序。優先條件順序:(1)全英語學士專班(分組/班)學生。(2)其他學士班學生。 
※英語授課",['法國語言、文化與社會學程'],False
https://selcrs.nsysu.edu.tw/menu5/showoutline.asp?SYEAR=113&SEM=1&CrsDat=GEAE2125&Crsname=台灣文化史,,,False,博雅向度一,GEAE2125,0,不分班,"台灣文化史
CULTURAL HISTORY OF TAIWAN",3,期,True,60,4,64,-4,江政寬,"四2,3,4(通GE 1008)","['', '', '', '234', '', '', '']",《講授類》,"['飲食文化微學程', '地方敘事與文化設計微學程', '日本研究學程', '臺灣研究學程', '社區文創微學程']",False
https://selcrs.nsysu.edu.tw/menu5/showoutline.asp?SYEAR=113&SEM=1&CrsDat=GEAE2135&Crsname=創意繪畫之美學實踐,新增,8/1,False,博雅向度一,GEAE2135,0,不分班,"創意繪畫之美學實踐
AESTHETIC PRACTICE OF CREATIVE PAINTING",2,期,True,50,7,50,0,王以亮,"五7,8(文FA 3009)","['', '', '', '', '78', '', '']",《講授類》,"['STREAM永續發展培力微學程', '臺灣研究學程']",False
